{
  "$schema": "../schema.json",
  "version": 1,
  "entry": {
    "displayName": "フォース・コーヒー — ステップ3：サプライチェーン",
    "displayDescription": "仕入先と出荷の流れを加えた、完全なモデルです。",
    "displayTags": [
      { "tag": "coffee", "displayName": "コーヒー" },
      { "tag": "retail", "displayName": "小売" },
      { "tag": "school", "displayName": "学習" },
      { "tag": "step-3", "displayName": "ステップ3" }
    ]
  },
  "ontology": {
    "displayName": "フォース・コーヒー — ステップ3",
    "displayDescription": "仕入先と出荷の流れを加え、豆の仕入れから提供までを表す完全なサプライチェーンモデルです。"
  },
  "entities": [
    {
      "id": "customer",
      "displayName": "顧客",
      "displayDescription": "注文を行うロイヤルティプログラム会員を表します。"
    },
    {
      "id": "order",
      "displayName": "注文",
      "displayDescription": "1つ以上の商品を含む購入取引を表します。"
    },
    {
      "id": "product",
      "displayName": "商品",
      "displayDescription": "販売可能なメニュー商品または物販商品を表します。"
    },
    {
      "id": "store",
      "displayName": "店舗",
      "displayDescription": "注文を調理・提供する実店舗を表します。"
    },
    {
      "id": "supplier",
      "displayName": "仕入先",
      "displayDescription": "コーヒー豆、原材料、物販商品を提供する取引先を表します。"
    },
    {
      "id": "shipment",
      "displayName": "出荷",
      "displayDescription": "仕入先から店舗へ商品を届ける配送を表します。"
    }
  ],
  "properties": [
    { "entityId": "customer", "propertyName": "customerId", "displayName": "顧客ID" },
    { "entityId": "customer", "propertyName": "name", "displayName": "氏名" },
    { "entityId": "customer", "propertyName": "email", "displayName": "メールアドレス" },
    { "entityId": "customer", "propertyName": "loyaltyTier", "displayName": "ロイヤルティランク" },
    { "entityId": "customer", "propertyName": "joinDate", "displayName": "登録日" },
    { "entityId": "customer", "propertyName": "totalSpend", "displayName": "累計利用額" },
    { "entityId": "order", "propertyName": "orderId", "displayName": "注文ID" },
    { "entityId": "order", "propertyName": "timestamp", "displayName": "注文日時" },
    { "entityId": "order", "propertyName": "total", "displayName": "注文合計" },
    { "entityId": "order", "propertyName": "status", "displayName": "注文状態" },
    { "entityId": "order", "propertyName": "paymentMethod", "displayName": "支払方法" },
    { "entityId": "product", "propertyName": "productId", "displayName": "商品ID" },
    { "entityId": "product", "propertyName": "name", "displayName": "商品名" },
    { "entityId": "product", "propertyName": "category", "displayName": "商品カテゴリ" },
    { "entityId": "product", "propertyName": "price", "displayName": "単価" },
    { "entityId": "product", "propertyName": "origin", "displayName": "原産国" },
    { "entityId": "product", "propertyName": "isOrganic", "displayName": "有機認証済み" },
    { "entityId": "store", "propertyName": "storeId", "displayName": "店舗ID" },
    { "entityId": "store", "propertyName": "name", "displayName": "店舗名" },
    { "entityId": "store", "propertyName": "city", "displayName": "市区町村" },
    { "entityId": "store", "propertyName": "state", "displayName": "州・地域" },
    { "entityId": "store", "propertyName": "openDate", "displayName": "開店日" },
    { "entityId": "store", "propertyName": "capacity", "displayName": "座席数" },
    { "entityId": "supplier", "propertyName": "supplierId", "displayName": "仕入先ID" },
    { "entityId": "supplier", "propertyName": "name", "displayName": "仕入先名" },
    { "entityId": "supplier", "propertyName": "country", "displayName": "所在国" },
    { "entityId": "supplier", "propertyName": "certification", "displayName": "認証" },
    { "entityId": "supplier", "propertyName": "rating", "displayName": "評価" },
    { "entityId": "shipment", "propertyName": "shipmentId", "displayName": "出荷ID" },
    { "entityId": "shipment", "propertyName": "dispatchDate", "displayName": "出荷日" },
    { "entityId": "shipment", "propertyName": "arrivalDate", "displayName": "到着日" },
    { "entityId": "shipment", "propertyName": "status", "displayName": "出荷状態" },
    { "entityId": "shipment", "propertyName": "weight", "displayName": "重量" }
  ],
  "relationships": [
    {
      "id": "customer_places_order",
      "displayName": "注文する",
      "displayDescription": "顧客が1件以上の注文を行うことを表します。"
    },
    {
      "id": "order_contains_product",
      "displayName": "商品を含む",
      "displayDescription": "注文が1つ以上の商品を含むことを表します。"
    },
    {
      "id": "order_processed_at_store",
      "displayName": "店舗で処理される",
      "displayDescription": "注文が特定の店舗で処理されることを表します。"
    },
    {
      "id": "product_sourced_from_supplier",
      "displayName": "仕入先から調達される",
      "displayDescription": "商品が仕入先から調達されることを表します。"
    },
    {
      "id": "shipment_from_supplier",
      "displayName": "仕入先が発送",
      "displayDescription": "出荷が仕入先から発送されることを表します。"
    },
    {
      "id": "shipment_to_store",
      "displayName": "店舗へ配送される",
      "displayDescription": "出荷が店舗へ届けられることを表します。"
    },
    {
      "id": "shipment_contains_product",
      "displayName": "商品を積載する",
      "displayDescription": "出荷が1つ以上の商品を運ぶことを表します。"
    }
  ],
  "relationshipAttributes": [],
  "enumValues": [
    { "entityId": "customer", "propertyName": "loyaltyTier", "value": "Bronze", "displayValue": "ブロンズ" },
    { "entityId": "customer", "propertyName": "loyaltyTier", "value": "Silver", "displayValue": "シルバー" },
    { "entityId": "customer", "propertyName": "loyaltyTier", "value": "Gold", "displayValue": "ゴールド" },
    { "entityId": "customer", "propertyName": "loyaltyTier", "value": "Platinum", "displayValue": "プラチナ" },
    { "entityId": "order", "propertyName": "status", "value": "Pending", "displayValue": "保留中" },
    { "entityId": "order", "propertyName": "status", "value": "Preparing", "displayValue": "準備中" },
    { "entityId": "order", "propertyName": "status", "value": "Ready", "displayValue": "提供準備完了" },
    { "entityId": "order", "propertyName": "status", "value": "Completed", "displayValue": "完了" },
    { "entityId": "order", "propertyName": "status", "value": "Cancelled", "displayValue": "キャンセル" },
    { "entityId": "order", "propertyName": "paymentMethod", "value": "Card", "displayValue": "カード" },
    { "entityId": "order", "propertyName": "paymentMethod", "value": "Cash", "displayValue": "現金" },
    { "entityId": "order", "propertyName": "paymentMethod", "value": "Mobile", "displayValue": "モバイル決済" },
    { "entityId": "order", "propertyName": "paymentMethod", "value": "Gift Card", "displayValue": "ギフトカード" },
    { "entityId": "product", "propertyName": "category", "value": "Espresso", "displayValue": "エスプレッソ" },
    { "entityId": "product", "propertyName": "category", "value": "Brewed", "displayValue": "抽出コーヒー" },
    { "entityId": "product", "propertyName": "category", "value": "Cold Brew", "displayValue": "コールドブリュー" },
    { "entityId": "product", "propertyName": "category", "value": "Tea", "displayValue": "お茶" },
    { "entityId": "product", "propertyName": "category", "value": "Food", "displayValue": "フード" },
    { "entityId": "product", "propertyName": "category", "value": "Merchandise", "displayValue": "物販" },
    { "entityId": "supplier", "propertyName": "certification", "value": "Fair Trade", "displayValue": "フェアトレード" },
    { "entityId": "supplier", "propertyName": "certification", "value": "Rainforest Alliance", "displayValue": "レインフォレスト・アライアンス" },
    { "entityId": "supplier", "propertyName": "certification", "value": "Organic", "displayValue": "有機" },
    { "entityId": "supplier", "propertyName": "certification", "value": "Direct Trade", "displayValue": "ダイレクトトレード" },
    { "entityId": "supplier", "propertyName": "certification", "value": "None", "displayValue": "なし" },
    { "entityId": "shipment", "propertyName": "status", "value": "In Transit", "displayValue": "輸送中" },
    { "entityId": "shipment", "propertyName": "status", "value": "Delivered", "displayValue": "配送済み" },
    { "entityId": "shipment", "propertyName": "status", "value": "Delayed", "displayValue": "遅延" }
  ]
}
