{
  "$schema": "../schema.json",
  "version": 1,
  "entry": {
    "displayName": "製造 — ステップ1：機械とセンサー",
    "displayDescription": "機械とセンサーによるIoT監視の基盤です。",
    "displayTags": [
      { "tag": "manufacturing", "displayName": "製造" },
      { "tag": "iot", "displayName": "IoT技術" },
      { "tag": "school", "displayName": "学習" },
      { "tag": "step-1", "displayName": "ステップ1" }
    ]
  },
  "ontology": {
    "displayName": "スマート製造 — ステップ1"
  },
  "entities": [
    {
      "id": "machine",
      "displayName": "機械",
      "displayDescription": "工場の生産設備を表します。"
    },
    {
      "id": "sensor",
      "displayName": "センサー",
      "displayDescription": "機械のパラメーターを監視するセンサー装置を表します。"
    }
  ],
  "properties": [
    { "entityId": "machine", "propertyName": "machineId", "displayName": "機械ID" },
    { "entityId": "machine", "propertyName": "model", "displayName": "モデル" },
    { "entityId": "machine", "propertyName": "location", "displayName": "設置場所" },
    { "entityId": "machine", "propertyName": "status", "displayName": "稼働状態" },
    { "entityId": "machine", "propertyName": "lastMaintenance", "displayName": "最終メンテナンス日" },
    { "entityId": "sensor", "propertyName": "sensorId", "displayName": "センサーID" },
    { "entityId": "sensor", "propertyName": "type", "displayName": "種類" },
    { "entityId": "sensor", "propertyName": "unit", "displayName": "単位" },
    { "entityId": "sensor", "propertyName": "minThreshold", "displayName": "最小しきい値" },
    { "entityId": "sensor", "propertyName": "maxThreshold", "displayName": "最大しきい値" }
  ],
  "relationships": [
    {
      "id": "machine_has_sensor",
      "displayName": "センサーで監視される",
      "displayDescription": "機械に取り付けられたセンサーを表します。"
    }
  ],
  "relationshipAttributes": [],
  "enumValues": []
}
