{
  "$schema": "../schema.json",
  "version": 1,
  "entry": {
    "displayName": "FIBOリスクラボ — ステップ3：ローン分類",
    "displayDescription": "Baselリスクウェイト、担保区分、OCC/FDICの集中区分を持つローン分類を追加します。",
    "displayTags": [
      {
        "tag": "fibo",
        "displayName": "FIBO（金融業界ビジネスオントロジー）"
      },
      {
        "tag": "risk",
        "displayName": "リスク"
      },
      {
        "tag": "loan",
        "displayName": "ローン"
      },
      {
        "tag": "basel",
        "displayName": "Basel III（自己資本規制）"
      },
      {
        "tag": "school",
        "displayName": "学習"
      },
      {
        "tag": "step-3",
        "displayName": "ステップ3"
      }
    ]
  },
  "ontology": {
    "displayName": "FIBOリスクラボ — ステップ3：ローン分類",
    "displayDescription": "産業・地理的階層に、Baselリスクウェイトを持つローン分類を加えたモデルです。"
  },
  "entities": [
    {
      "id": "sector",
      "displayName": "セクター",
      "displayDescription": "幅広い機能によって産業をまとめる経済分類の最上位区分です。"
    },
    {
      "id": "subsector",
      "displayName": "サブセクター",
      "displayDescription": "経済セクターをより細かく分類した下位区分です。"
    },
    {
      "id": "industryGroup",
      "displayName": "産業グループ",
      "displayDescription": "リスク分析のため、NAICSで符号化し気候感応度と景気循環性を持つ産業グループです。"
    },
    {
      "id": "region",
      "displayName": "地域",
      "displayDescription": "マクロ経済分析のため、大陸または地理的地域をまとめる区分です。"
    },
    {
      "id": "country",
      "displayName": "国",
      "displayDescription": "経済区分、通貨、規制フレームワークの属性を持つ国家です。"
    },
    {
      "id": "jurisdiction",
      "displayName": "管轄区域",
      "displayDescription": "ハリケーン、洪水、地震、山火事のリスク地域フラグを持つ、国より下位の管轄区域です。"
    },
    {
      "id": "concentrationCategory",
      "displayName": "集中区分",
      "displayDescription": "ポートフォリオのリスク管理についてOCC/FDICガイダンスが定める規制上の集中区分です。"
    },
    {
      "id": "loanType",
      "displayName": "ローン種別",
      "displayDescription": "Basel IIIのリスクウェイト、規制上の取扱い、自己資本区分を持つローン商品の分類です。"
    },
    {
      "id": "collateralType",
      "displayName": "担保種別",
      "displayDescription": "回収見込みと集中区分を持つ担保資産の分類です。"
    }
  ],
  "properties": [
    {
      "entityId": "sector",
      "propertyName": "sectorCode",
      "displayName": "セクターコード"
    },
    {
      "entityId": "sector",
      "propertyName": "sectorName",
      "displayName": "セクター名"
    },
    {
      "entityId": "sector",
      "propertyName": "description",
      "displayName": "説明"
    },
    {
      "entityId": "subsector",
      "propertyName": "subsectorCode",
      "displayName": "サブセクターコード"
    },
    {
      "entityId": "subsector",
      "propertyName": "subsectorName",
      "displayName": "サブセクター名"
    },
    {
      "entityId": "industryGroup",
      "propertyName": "naicsCode",
      "displayName": "NAICSコード"
    },
    {
      "entityId": "industryGroup",
      "propertyName": "name",
      "displayName": "名称"
    },
    {
      "entityId": "industryGroup",
      "propertyName": "cyclicality",
      "displayName": "景気循環性"
    },
    {
      "entityId": "industryGroup",
      "propertyName": "climateSensitivity",
      "displayName": "気候感応度"
    },
    {
      "entityId": "industryGroup",
      "propertyName": "essentialServices",
      "displayName": "必須サービス"
    },
    {
      "entityId": "industryGroup",
      "propertyName": "description",
      "displayName": "説明"
    },
    {
      "entityId": "region",
      "propertyName": "regionCode",
      "displayName": "地域コード"
    },
    {
      "entityId": "region",
      "propertyName": "regionName",
      "displayName": "地域名"
    },
    {
      "entityId": "region",
      "propertyName": "description",
      "displayName": "説明"
    },
    {
      "entityId": "region",
      "propertyName": "disasterProfile",
      "displayName": "災害プロファイル"
    },
    {
      "entityId": "country",
      "propertyName": "countryCode",
      "displayName": "国コード"
    },
    {
      "entityId": "country",
      "propertyName": "countryName",
      "displayName": "国名"
    },
    {
      "entityId": "country",
      "propertyName": "economicZone",
      "displayName": "経済区分"
    },
    {
      "entityId": "country",
      "propertyName": "currency",
      "displayName": "通貨コード"
    },
    {
      "entityId": "country",
      "propertyName": "regulatoryFramework",
      "displayName": "規制フレームワーク"
    },
    {
      "entityId": "jurisdiction",
      "propertyName": "code",
      "displayName": "管轄区域コード"
    },
    {
      "entityId": "jurisdiction",
      "propertyName": "name",
      "displayName": "名称"
    },
    {
      "entityId": "jurisdiction",
      "propertyName": "hurricaneZone",
      "displayName": "ハリケーン地域"
    },
    {
      "entityId": "jurisdiction",
      "propertyName": "floodZone",
      "displayName": "洪水地域"
    },
    {
      "entityId": "jurisdiction",
      "propertyName": "earthquakeZone",
      "displayName": "地震地域"
    },
    {
      "entityId": "jurisdiction",
      "propertyName": "wildfireZone",
      "displayName": "山火事地域"
    },
    {
      "entityId": "jurisdiction",
      "propertyName": "coastal",
      "displayName": "沿岸地域"
    },
    {
      "entityId": "jurisdiction",
      "propertyName": "latitude",
      "displayName": "緯度"
    },
    {
      "entityId": "jurisdiction",
      "propertyName": "longitude",
      "displayName": "経度"
    },
    {
      "entityId": "concentrationCategory",
      "propertyName": "categoryId",
      "displayName": "集中区分ID"
    },
    {
      "entityId": "concentrationCategory",
      "propertyName": "name",
      "displayName": "名称"
    },
    {
      "entityId": "concentrationCategory",
      "propertyName": "description",
      "displayName": "説明"
    },
    {
      "entityId": "concentrationCategory",
      "propertyName": "occGuidance",
      "displayName": "OCCガイダンス"
    },
    {
      "entityId": "loanType",
      "propertyName": "loanTypeCode",
      "displayName": "ローン種別コード"
    },
    {
      "entityId": "loanType",
      "propertyName": "name",
      "displayName": "名称"
    },
    {
      "entityId": "loanType",
      "propertyName": "baselRiskWeight",
      "displayName": "Basel IIIリスクウェイト"
    },
    {
      "entityId": "loanType",
      "propertyName": "regulatoryTreatment",
      "displayName": "規制上の取扱い"
    },
    {
      "entityId": "loanType",
      "propertyName": "capitalTier",
      "displayName": "自己資本区分"
    },
    {
      "entityId": "loanType",
      "propertyName": "description",
      "displayName": "説明"
    },
    {
      "entityId": "collateralType",
      "propertyName": "collateralTypeCode",
      "displayName": "担保種別コード"
    },
    {
      "entityId": "collateralType",
      "propertyName": "name",
      "displayName": "名称"
    },
    {
      "entityId": "collateralType",
      "propertyName": "recoveryExpectation",
      "displayName": "回収見込み"
    },
    {
      "entityId": "collateralType",
      "propertyName": "description",
      "displayName": "説明"
    }
  ],
  "relationships": [
    {
      "id": "partOfSector",
      "displayName": "セクターに属する",
      "displayDescription": "サブセクターを親の経済セクターへ関連付けます。"
    },
    {
      "id": "belongsToSubsector",
      "displayName": "サブセクターに属する",
      "displayDescription": "産業グループを親のサブセクターへ関連付けます。"
    },
    {
      "id": "inCountry",
      "displayName": "国に属する",
      "displayDescription": "管轄区域を所属する国へ関連付けます。"
    },
    {
      "id": "inRegion",
      "displayName": "地域に属する",
      "displayDescription": "管轄区域を地理的地域へ関連付けます。"
    },
    {
      "id": "loanClassifiedAs",
      "displayName": "ローン種別を集中区分に分類する",
      "displayDescription": "ローン種別をOCC/FDICの集中区分へ分類します。"
    },
    {
      "id": "collateralClassifiedAs",
      "displayName": "担保種別を集中区分に分類する",
      "displayDescription": "担保種別をOCC/FDICの集中区分へ分類します。"
    },
    {
      "id": "typicallySecuredBy",
      "displayName": "通常このローン種別の担保となる",
      "displayDescription": "担保種別を、通常それで担保されるローン種別へ関連付けます。"
    }
  ],
  "relationshipAttributes": [],
  "enumValues": []
}
